{
  "canonical_model_id": null,
  "fine_tuned_from_model_id": null,
  "name": "Qwen2 72B Instruct",
  "description": "Qwen2-72B-Instruct is an instruction-tuned language model with 72 billion parameters, supporting a context length of up to 131,072 tokens. It's part of the new Qwen2 series, which has surpassed most open-source models and demonstrates competitiveness against proprietary models across various benchmarks.",
  "release_date": "2024-07-23",
  "input_context_size": 131072,
  "output_context_size": 131072,
  "license": "tongyi-qianwen",
  "multimodal": false,
  "web_hydrated": false,
  "knowledge_cutoff": null,
  "api_ref_link": "https://huggingface.co/Qwen/Qwen2-72B",
  "playground_link": "https://huggingface.co/Qwen/Qwen2-72B",
  "paper_link": "https://arxiv.org/abs/2309.00071",
  "scorecard_blog_link": "https://qwenlm.github.io/blog/qwen2/",
  "repo_link": "https://huggingface.co/Qwen/Qwen2-72B",
  "weights_link": "https://huggingface.co/Qwen/Qwen2-72B",
  "param_count": 72000000000,
  "training_tokens": null,
  "qualitative_metrics": [
    {
      "dataset_name": "MMLU",
      "score": 0.823,
      "is_self_reported": true,
      "analysis_method": "Accuracy",
      "date_recorded": "2024-03-18",
      "source_link": "https://huggingface.co/Qwen/Qwen2-72B"
    },
    {
      "dataset_name": "MMLU-Pro",
      "score": 0.644,
      "is_self_reported": true,
      "analysis_method": "Accuracy",
      "date_recorded": "2024-03-18",
      "source_link": "https://huggingface.co/Qwen/Qwen2-72B"
    },
    {
      "dataset_name": "GPQA",
      "score": 0.424,
      "is_self_reported": true,
      "analysis_method": "Accuracy",
      "date_recorded": "2024-03-18",
      "source_link": "https://huggingface.co/Qwen/Qwen2-72B"
    },
    {
      "dataset_name": "TheroemQA",
      "score": 0.444,
      "is_self_reported": true,
      "analysis_method": "Accuracy",
      "date_recorded": "2024-03-18",
      "source_link": "https://huggingface.co/Qwen/Qwen2-72B"
    },
    {
      "dataset_name": "BBH",
      "score": 0.824,
      "is_self_reported": true,
      "analysis_method": "Accuracy",
      "date_recorded": "2024-03-18",
      "source_link": "https://huggingface.co/Qwen/Qwen2-72B"
    },
    {
      "dataset_name": "HellaSwag",
      "score": 0.876,
      "is_self_reported": true,
      "analysis_method": "Accuracy",
      "date_recorded": "2024-03-18",
      "source_link": "https://huggingface.co/Qwen/Qwen2-72B"
    },
    {
      "dataset_name": "Winogrande",
      "score": 0.851,
      "is_self_reported": true,
      "analysis_method": "Accuracy",
      "date_recorded": "2024-03-18",
      "source_link": "https://huggingface.co/Qwen/Qwen2-72B"
    },
    {
      "dataset_name": "TruthfulQA",
      "score": 0.548,
      "is_self_reported": true,
      "analysis_method": "Accuracy",
      "date_recorded": "2024-03-18",
      "source_link": "https://huggingface.co/Qwen/Qwen2-72B"
    },
    {
      "dataset_name": "ARC-C",
      "score": 0.689,
      "is_self_reported": true,
      "analysis_method": "Accuracy",
      "date_recorded": "2024-03-18",
      "source_link": "https://huggingface.co/Qwen/Qwen2-72B"
    },
    {
      "dataset_name": "HumanEval",
      "score": 0.86,
      "is_self_reported": true,
      "analysis_method": "Pass@1",
      "date_recorded": "2024-03-18",
      "source_link": "https://huggingface.co/Qwen/Qwen2-72B"
    },
    {
      "dataset_name": "MBPP",
      "score": 0.802,
      "is_self_reported": true,
      "analysis_method": "Pass@1",
      "date_recorded": "2024-03-18",
      "source_link": "https://huggingface.co/Qwen/Qwen2-72B"
    },
    {
      "dataset_name": "EvalPlus",
      "score": 0.79,
      "is_self_reported": true,
      "analysis_method": "Pass@1",
      "date_recorded": "2024-03-18",
      "source_link": "https://huggingface.co/Qwen/Qwen2-72B"
    },
    {
      "dataset_name": "MultiPL-E",
      "score": 0.692,
      "is_self_reported": true,
      "analysis_method": "Pass@1",
      "date_recorded": "2024-03-18",
      "source_link": "https://huggingface.co/Qwen/Qwen2-72B"
    },
    {
      "dataset_name": "GSM8K",
      "score": 0.911,
      "is_self_reported": true,
      "analysis_method": "Accuracy",
      "date_recorded": "2024-03-18",
      "source_link": "https://huggingface.co/Qwen/Qwen2-72B"
    },
    {
      "dataset_name": "MATH",
      "score": 0.597,
      "is_self_reported": true,
      "analysis_method": "Accuracy",
      "date_recorded": "2024-03-18",
      "source_link": "https://huggingface.co/Qwen/Qwen2-72B"
    },
    {
      "dataset_name": "C-Eval",
      "score": 0.838,
      "is_self_reported": true,
      "analysis_method": "Accuracy",
      "date_recorded": "2024-03-18",
      "source_link": "https://huggingface.co/Qwen/Qwen2-72B"
    },
    {
      "dataset_name": "CMMLU",
      "score": 0.901,
      "is_self_reported": true,
      "analysis_method": "Accuracy",
      "date_recorded": "2024-03-18",
      "source_link": "https://huggingface.co/Qwen/Qwen2-72B"
    }
  ]
}
