{
  "canonical_model_id": null,
  "fine_tuned_from_model_id": null,
  "name": "Llama 3.1 8B Instruct",
  "description": "Llama 3.1 8B Instruct is a multilingual large language model optimized for dialogue use cases. It features a 128K context length, state-of-the-art tool use, and strong reasoning capabilities.",
  "release_date": "2024-07-23",
  "input_context_size": 131072,
  "output_context_size": 131072,
  "license": "Llama 3.1 Community License",
  "multimodal": false,
  "web_hydrated": false,
  "knowledge_cutoff": "2023-12-31",
  "api_ref_link": "https://www.llama.com/",
  "playground_link": null,
  "paper_link": null,
  "scorecard_blog_link": "https://ai.meta.com/blog/meta-llama-3-1/",
  "repo_link": "https://github.com/meta-llama/llama-models",
  "weights_link": "https://huggingface.co/meta-llama/Meta-Llama-3.1-8B-Instruct",
  "param_count": 8000000000,
  "training_tokens": 15000000000000,
  "qualitative_metrics": [
    {
      "dataset_name": "MMLU",
      "score": 0.694,
      "is_self_reported": true,
      "analysis_method": "5-shot",
      "date_recorded": "2024-07-23",
      "source_link": "https://huggingface.co/meta-llama/Meta-Llama-3.1-8B-Instruct"
    },
    {
      "dataset_name": "MMLU (CoT)",
      "score": 0.73,
      "is_self_reported": true,
      "analysis_method": "0-shot",
      "date_recorded": "2024-07-23",
      "source_link": "https://huggingface.co/meta-llama/Meta-Llama-3.1-8B-Instruct"
    },
    {
      "dataset_name": "MMLU-Pro",
      "score": 0.483,
      "is_self_reported": true,
      "analysis_method": "5-shot",
      "date_recorded": "2024-07-23",
      "source_link": "https://huggingface.co/meta-llama/Meta-Llama-3.1-8B-Instruct"
    },
    {
      "dataset_name": "IFEval",
      "score": 0.804,
      "is_self_reported": true,
      "analysis_method": "unspecified",
      "date_recorded": "2024-07-23",
      "source_link": "https://huggingface.co/meta-llama/Meta-Llama-3.1-8B-Instruct"
    },
    {
      "dataset_name": "ARC-C",
      "score": 0.834,
      "is_self_reported": true,
      "analysis_method": "0-shot",
      "date_recorded": "2024-07-23",
      "source_link": "https://huggingface.co/meta-llama/Meta-Llama-3.1-8B-Instruct"
    },
    {
      "dataset_name": "GPQA",
      "score": 0.304,
      "is_self_reported": true,
      "analysis_method": "0-shot",
      "date_recorded": "2024-07-23",
      "source_link": "https://huggingface.co/meta-llama/Meta-Llama-3.1-8B-Instruct"
    },
    {
      "dataset_name": "HumanEval",
      "score": 0.726,
      "is_self_reported": true,
      "analysis_method": "0-shot",
      "date_recorded": "2024-07-23",
      "source_link": "https://huggingface.co/meta-llama/Meta-Llama-3.1-8B-Instruct"
    },
    {
      "dataset_name": "MBPP EvalPlus (base)",
      "score": 0.728,
      "is_self_reported": true,
      "analysis_method": "0-shot",
      "date_recorded": "2024-07-23",
      "source_link": "https://huggingface.co/meta-llama/Meta-Llama-3.1-8B-Instruct"
    },
    {
      "dataset_name": "Multipl-E HumanEval",
      "score": 0.508,
      "is_self_reported": true,
      "analysis_method": "0-shot",
      "date_recorded": "2024-07-23",
      "source_link": "https://huggingface.co/meta-llama/Meta-Llama-3.1-8B-Instruct"
    },
    {
      "dataset_name": "Multipl-E MBPP",
      "score": 0.524,
      "is_self_reported": true,
      "analysis_method": "0-shot",
      "date_recorded": "2024-07-23",
      "source_link": "https://huggingface.co/meta-llama/Meta-Llama-3.1-8B-Instruct"
    },
    {
      "dataset_name": "GSM-8K (CoT)",
      "score": 0.845,
      "is_self_reported": true,
      "analysis_method": "8-shot",
      "date_recorded": "2024-07-23",
      "source_link": "https://huggingface.co/meta-llama/Meta-Llama-3.1-8B-Instruct"
    },
    {
      "dataset_name": "MATH (CoT)",
      "score": 0.519,
      "is_self_reported": true,
      "analysis_method": "0-shot",
      "date_recorded": "2024-07-23",
      "source_link": "https://huggingface.co/meta-llama/Meta-Llama-3.1-8B-Instruct"
    },
    {
      "dataset_name": "API-Bank",
      "score": 0.826,
      "is_self_reported": true,
      "analysis_method": "0-shot",
      "date_recorded": "2024-07-23",
      "source_link": "https://huggingface.co/meta-llama/Meta-Llama-3.1-8B-Instruct"
    },
    {
      "dataset_name": "BFCL",
      "score": 0.761,
      "is_self_reported": true,
      "analysis_method": "0-shot",
      "date_recorded": "2024-07-23",
      "source_link": "https://huggingface.co/meta-llama/Meta-Llama-3.1-8B-Instruct"
    },
    {
      "dataset_name": "Gorilla Benchmark API Bench",
      "score": 0.082,
      "is_self_reported": true,
      "analysis_method": "0-shot",
      "date_recorded": "2024-07-23",
      "source_link": "https://huggingface.co/meta-llama/Meta-Llama-3.1-8B-Instruct"
    },
    {
      "dataset_name": "Nexus",
      "score": 0.385,
      "is_self_reported": true,
      "analysis_method": "0-shot",
      "date_recorded": "2024-07-23",
      "source_link": "https://huggingface.co/meta-llama/Meta-Llama-3.1-8B-Instruct"
    },
    {
      "dataset_name": "Multilingual MGSM (CoT)",
      "score": 0.689,
      "is_self_reported": true,
      "analysis_method": "0-shot",
      "date_recorded": "2024-07-23",
      "source_link": "https://huggingface.co/meta-llama/Meta-Llama-3.1-8B-Instruct"
    },
    {
      "dataset_name": "DROP",
      "score": 0.595,
      "is_self_reported": true,
      "analysis_method": "0-shot",
      "date_recorded": "2024-07-23",
      "source_link": "https://arxiv.org/pdf/2407.21783"
    }
  ]
}
