{
  "canonical_model_id": null,
  "fine_tuned_from_model_id": null,
  "name": "Gemma 3 4B",
  "description": "Gemma 3 4B is a 4-billion-parameter vision-language model from Google, handling text and image input and generating text output. It features a 128K context window, multilingual support, and open weights. Suitable for question answering, summarization, reasoning, and image understanding tasks.",
  "release_date": "2025-03-12",
  "input_context_size": 131072,
  "output_context_size": 131072,
  "license": "gemma",
  "multimodal": true,
  "web_hydrated": false,
  "knowledge_cutoff": "2024-08-01",
  "api_ref_link": null,
  "playground_link": null,
  "paper_link": "https://storage.googleapis.com/deepmind-media/gemma/Gemma3Report.pdf",
  "scorecard_blog_link": "https://huggingface.co/blog/gemma3",
  "repo_link": null,
  "weights_link": "https://huggingface.co/google/gemma-3-4b-it",
  "param_count": 4000000000,
  "training_tokens": 4000000000000,
  "qualitative_metrics": [
    {
      "dataset_name": "GPQA",
      "score": 0.308,
      "is_self_reported": true,
      "analysis_method": "0-shot evaluation diamond",
      "date_recorded": "2025-03-12",
      "source_link": "https://ai.google.dev/gemma/docs/core/model_card_3"
    },
    {
      "dataset_name": "SimpleQA",
      "score": 0.04,
      "is_self_reported": true,
      "analysis_method": "0-shot evaluation",
      "date_recorded": "2025-03-12",
      "source_link": "https://ai.google.dev/gemma/docs/core/model_card_3"
    },
    {
      "dataset_name": "FACTS Grounding",
      "score": 0.701,
      "is_self_reported": true,
      "analysis_method": "- evaluation",
      "date_recorded": "2025-03-12",
      "source_link": "https://ai.google.dev/gemma/docs/core/model_card_3"
    },
    {
      "dataset_name": "BIG-Bench Hard",
      "score": 0.722,
      "is_self_reported": true,
      "analysis_method": "0-shot evaluation",
      "date_recorded": "2025-03-12",
      "source_link": "https://ai.google.dev/gemma/docs/core/model_card_3"
    },
    {
      "dataset_name": "BIG-Bench Extra Hard",
      "score": 0.11,
      "is_self_reported": true,
      "analysis_method": "0-shot evaluation",
      "date_recorded": "2025-03-12",
      "source_link": "https://ai.google.dev/gemma/docs/core/model_card_3"
    },
    {
      "dataset_name": "IFEval",
      "score": 0.902,
      "is_self_reported": true,
      "analysis_method": "0-shot evaluation",
      "date_recorded": "2025-03-12",
      "source_link": "https://ai.google.dev/gemma/docs/core/model_card_3"
    },
    {
      "dataset_name": "MMLU-Pro",
      "score": 0.436,
      "is_self_reported": true,
      "analysis_method": "0-shot evaluation",
      "date_recorded": "2025-03-12",
      "source_link": "https://ai.google.dev/gemma/docs/core/model_card_3"
    },
    {
      "dataset_name": "LiveCodeBench",
      "score": 0.126,
      "is_self_reported": true,
      "analysis_method": "0-shot evaluation",
      "date_recorded": "2025-03-12",
      "source_link": "https://ai.google.dev/gemma/docs/core/model_card_3"
    },
    {
      "dataset_name": "Bird-SQL (dev)",
      "score": 0.363,
      "is_self_reported": true,
      "analysis_method": "- evaluation",
      "date_recorded": "2025-03-12",
      "source_link": "https://ai.google.dev/gemma/docs/core/model_card_3"
    },
    {
      "dataset_name": "MATH",
      "score": 0.756,
      "is_self_reported": true,
      "analysis_method": "0-shot evaluation",
      "date_recorded": "2025-03-12",
      "source_link": "https://ai.google.dev/gemma/docs/core/model_card_3"
    },
    {
      "dataset_name": "HiddenMath",
      "score": 0.43,
      "is_self_reported": true,
      "analysis_method": "0-shot evaluation",
      "date_recorded": "2025-03-12",
      "source_link": "https://ai.google.dev/gemma/docs/core/model_card_3"
    },
    {
      "dataset_name": "MBPP",
      "score": 0.632,
      "is_self_reported": true,
      "analysis_method": "3-shot evaluation",
      "date_recorded": "2025-03-12",
      "source_link": "https://ai.google.dev/gemma/docs/core/model_card_3"
    },
    {
      "dataset_name": "HumanEval",
      "score": 0.713,
      "is_self_reported": true,
      "analysis_method": "0-shot evaluation",
      "date_recorded": "2025-03-12",
      "source_link": "https://ai.google.dev/gemma/docs/core/model_card_3"
    },
    {
      "dataset_name": "Natural2Code",
      "score": 0.703,
      "is_self_reported": true,
      "analysis_method": "0-shot evaluation",
      "date_recorded": "2025-03-12",
      "source_link": "https://ai.google.dev/gemma/docs/core/model_card_3"
    },
    {
      "dataset_name": "GSM8K",
      "score": 0.892,
      "is_self_reported": true,
      "analysis_method": "0-shot evaluation",
      "date_recorded": "2025-03-12",
      "source_link": "https://ai.google.dev/gemma/docs/core/model_card_3"
    },
    {
      "dataset_name": "Global-MMLU-Lite",
      "score": 0.545,
      "is_self_reported": true,
      "analysis_method": "0-shot evaluation",
      "date_recorded": "2025-03-12",
      "source_link": "https://ai.google.dev/gemma/docs/core/model_card_3"
    },
    {
      "dataset_name": "ECLeKTic",
      "score": 0.046,
      "is_self_reported": true,
      "analysis_method": "0-shot evaluation",
      "date_recorded": "2025-03-12",
      "source_link": "https://ai.google.dev/gemma/docs/core/model_card_3"
    },
    {
      "dataset_name": "WMT24++",
      "score": 0.468,
      "is_self_reported": true,
      "analysis_method": "0-shot evaluation",
      "date_recorded": "2025-03-12",
      "source_link": "https://ai.google.dev/gemma/docs/core/model_card_3"
    },
    {
      "dataset_name": "MMMU (val)",
      "score": 0.488,
      "is_self_reported": true,
      "analysis_method": "multimodal evaluation",
      "date_recorded": "2025-03-12",
      "source_link": "https://ai.google.dev/gemma/docs/core/model_card_3"
    },
    {
      "dataset_name": "DocVQA",
      "score": 0.758,
      "is_self_reported": true,
      "analysis_method": "multimodal evaluation",
      "date_recorded": "2025-03-12",
      "source_link": "https://ai.google.dev/gemma/docs/core/model_card_3"
    },
    {
      "dataset_name": "InfoVQA",
      "score": 0.5,
      "is_self_reported": true,
      "analysis_method": "multimodal evaluation",
      "date_recorded": "2025-03-12",
      "source_link": "https://ai.google.dev/gemma/docs/core/model_card_3"
    },
    {
      "dataset_name": "TextVQA",
      "score": 0.578,
      "is_self_reported": true,
      "analysis_method": "multimodal evaluation",
      "date_recorded": "2025-03-12",
      "source_link": "https://ai.google.dev/gemma/docs/core/model_card_3"
    },
    {
      "dataset_name": "AI2D",
      "score": 0.748,
      "is_self_reported": true,
      "analysis_method": "multimodal evaluation",
      "date_recorded": "2025-03-12",
      "source_link": "https://ai.google.dev/gemma/docs/core/model_card_3"
    },
    {
      "dataset_name": "ChartQA",
      "score": 0.688,
      "is_self_reported": true,
      "analysis_method": "multimodal evaluation",
      "date_recorded": "2025-03-12",
      "source_link": "https://ai.google.dev/gemma/docs/core/model_card_3"
    },
    {
      "dataset_name": "VQAv2 (val)",
      "score": 0.624,
      "is_self_reported": true,
      "analysis_method": "multimodal evaluation",
      "date_recorded": "2025-03-12",
      "source_link": "https://ai.google.dev/gemma/docs/core/model_card_3"
    },
    {
      "dataset_name": "MathVista-Mini",
      "score": 0.5,
      "is_self_reported": true,
      "analysis_method": "multimodal evaluation",
      "date_recorded": "2025-03-12",
      "source_link": "https://ai.google.dev/gemma/docs/core/model_card_3"
    }
  ]
}
