{
  "canonical_model_id": null,
  "fine_tuned_from_model_id": null,
  "name": "Gemini 1.5 Pro",
  "description": "Gemini 1.5 Pro is a mid-size multimodal model optimized for a wide range of reasoning tasks. It can process large amounts of data at once, including 2 hours of video, 19 hours of audio, codebases with 60,000 lines of code, or 2,000 pages of text.",
  "release_date": "2024-05-01",
  "input_context_size": 2097152,
  "output_context_size": 8192,
  "license": "Proprietary",
  "multimodal": true,
  "web_hydrated": false,
  "knowledge_cutoff": "2023-11-01",
  "api_ref_link": "https://ai.google.dev/gemini-api/docs/models/gemini#gemini-1.5-pro",
  "playground_link": "https://ai.google.dev/studio",
  "paper_link": "https://arxiv.org/pdf/2403.05530",
  "scorecard_blog_link": "https://deepmind.google/technologies/gemini/pro/",
  "repo_link": null,
  "weights_link": null,
  "param_count": null,
  "training_tokens": null,
  "qualitative_metrics": [
    {
      "dataset_name": "MMLU",
      "score": 0.859,
      "is_self_reported": true,
      "analysis_method": "5-shot",
      "date_recorded": "2024-09-01",
      "source_link": "https://arxiv.org/pdf/2403.05530"
    },
    {
      "dataset_name": "MMLU-Pro",
      "score": 0.758,
      "is_self_reported": true,
      "analysis_method": "0-shot CoT",
      "date_recorded": "2024-09-01",
      "source_link": "https://deepmind.google/technologies/gemini/pro/"
    },
    {
      "dataset_name": "PhysicsFinals",
      "score": 0.639,
      "is_self_reported": true,
      "analysis_method": "0-shot",
      "date_recorded": "2024-09-01",
      "source_link": "https://arxiv.org/pdf/2403.05530"
    },
    {
      "dataset_name": "FunctionalMATH",
      "score": 0.646,
      "is_self_reported": true,
      "analysis_method": "0-shot",
      "date_recorded": "2024-09-01",
      "source_link": "https://arxiv.org/pdf/2403.05530"
    },
    {
      "dataset_name": "AMC_2022_23",
      "score": 0.464,
      "is_self_reported": true,
      "analysis_method": "4-shot",
      "date_recorded": "2024-09-01",
      "source_link": "https://arxiv.org/pdf/2403.05530"
    },
    {
      "dataset_name": "GSM8K",
      "score": 0.908,
      "is_self_reported": true,
      "analysis_method": "11-shot",
      "date_recorded": "2024-09-01",
      "source_link": "https://arxiv.org/pdf/2403.05530"
    },
    {
      "dataset_name": "BIG-Bench Hard",
      "score": 0.892,
      "is_self_reported": true,
      "analysis_method": "3-shot",
      "date_recorded": "2024-09-01",
      "source_link": "https://arxiv.org/pdf/2403.05530"
    },
    {
      "dataset_name": "DROP",
      "score": 0.749,
      "is_self_reported": true,
      "analysis_method": "Variable shots",
      "date_recorded": "2024-09-01",
      "source_link": "https://arxiv.org/pdf/2403.05530"
    },
    {
      "dataset_name": "HellaSwag",
      "score": 0.933,
      "is_self_reported": true,
      "analysis_method": "10-shot",
      "date_recorded": "2024-09-01",
      "source_link": "https://arxiv.org/pdf/2403.05530"
    },
    {
      "dataset_name": "HumanEval",
      "score": 0.841,
      "is_self_reported": true,
      "analysis_method": "0-shot",
      "date_recorded": "2024-09-01",
      "source_link": "https://arxiv.org/pdf/2403.05530"
    },
    {
      "dataset_name": "MGSM",
      "score": 0.875,
      "is_self_reported": true,
      "analysis_method": "8-shot",
      "date_recorded": "2024-09-01",
      "source_link": "https://arxiv.org/pdf/2403.05530"
    },
    {
      "dataset_name": "Natural2Code",
      "score": 0.854,
      "is_self_reported": true,
      "analysis_method": "Accuracy",
      "date_recorded": "2024-09-01",
      "source_link": "https://deepmind.google/technologies/gemini/pro/"
    },
    {
      "dataset_name": "MATH",
      "score": 0.865,
      "is_self_reported": true,
      "analysis_method": "Accuracy",
      "date_recorded": "2024-09-01",
      "source_link": "https://deepmind.google/technologies/gemini/pro/"
    },
    {
      "dataset_name": "HiddenMath",
      "score": 0.52,
      "is_self_reported": true,
      "analysis_method": "Accuracy",
      "date_recorded": "2024-09-01",
      "source_link": "https://deepmind.google/technologies/gemini/pro/"
    },
    {
      "dataset_name": "GPQA",
      "score": 0.591,
      "is_self_reported": true,
      "analysis_method": "Accuracy",
      "date_recorded": "2024-09-01",
      "source_link": "https://deepmind.google/technologies/gemini/pro/"
    },
    {
      "dataset_name": "MRCR",
      "score": 0.826,
      "is_self_reported": true,
      "analysis_method": "Accuracy",
      "date_recorded": "2024-09-01",
      "source_link": "https://deepmind.google/technologies/gemini/pro/"
    },
    {
      "dataset_name": "WMT23",
      "score": 0.751,
      "is_self_reported": true,
      "analysis_method": "Score",
      "date_recorded": "2024-09-01",
      "source_link": "https://deepmind.google/technologies/gemini/pro/"
    },
    {
      "dataset_name": "MMMU",
      "score": 0.659,
      "is_self_reported": true,
      "analysis_method": "Accuracy",
      "date_recorded": "2024-09-01",
      "source_link": "https://deepmind.google/technologies/gemini/pro/"
    },
    {
      "dataset_name": "MathVista",
      "score": 0.681,
      "is_self_reported": true,
      "analysis_method": "Accuracy",
      "date_recorded": "2024-09-01",
      "source_link": "https://deepmind.google/technologies/gemini/pro/"
    },
    {
      "dataset_name": "FLEURS",
      "score": 0.067,
      "is_self_reported": true,
      "analysis_method": "Word Error Rate",
      "date_recorded": "2024-09-01",
      "source_link": "https://deepmind.google/technologies/gemini/pro/"
    },
    {
      "dataset_name": "Video-MME",
      "score": 0.786,
      "is_self_reported": true,
      "analysis_method": "Accuracy",
      "date_recorded": "2024-09-01",
      "source_link": "https://deepmind.google/technologies/gemini/pro/"
    },
    {
      "dataset_name": "Vibe-Eval",
      "score": 0.539,
      "is_self_reported": true,
      "analysis_method": "Accuracy",
      "date_recorded": "2024-09-01",
      "source_link": "https://deepmind.google/technologies/gemini/pro/"
    },
    {
      "dataset_name": "XSTest",
      "score": 0.988,
      "is_self_reported": true,
      "analysis_method": "Safety Compliance",
      "date_recorded": "2024-09-01",
      "source_link": "https://deepmind.google/technologies/gemini/pro/"
    }
  ]
}
